grabacion,modelo,transcripcion,tiempo
audio_cpbx06.vozelia.com.pa-1748869173.19935707,base," Hola buenos días. ¿Qué buenos días? Tengo el gusto con el señor Raúl. Y continuamos. La comodiana se arrogan a otra. Estaban mirando por acá que usted me puso buenos días, Vente. ¿Cómo le hicimos aquí? Y le hicimos que la invasas a que la invasas a la vez que estés en el día de hoy. ¿Qué si vendemos tan que de tica, Vente? Sí, este, vale bien. A le dín, es bueno, que se parcelas con vos. Ah, sí. ¿Y igual manera de que se casquen? La que voy a ver, es que es el calito pequeño. Ok, voy a asignar lo que es una oportunidad. Para una compañera que ve eso de tipo de tanques en el tirácie y todo lo que sea el tirácie. Entonces, ¿cómo le cano se con un ser? Bueno, sí, lo que quería decir es que no se donde construiría porque he perdido el tirácie. Ah, compre el bueno déjenme con que el dan por acá. ¿Enciende? Ah, sí. Muy buen día.",14.090470790863037
audio_cpbx06.vozelia.com.pa-1748869815.19945115,base," ¿A lo? Bueno, ya se van a ir a jugar. Sí, ¿Van a via? Tenía jugar en la mujer de parte de esto, ¿no? ¿Tras? Correyes de ella, ¿me? Me indica un compañero que interesa una nueva consistencia. Sí, en un poste. La Ocicor se compró una segunda y una mayor de lo por dos. Y una puerta con los respectivos force, pero como dicen, sí, corre el teopero, ¿no? Sí, yo lo restringé a teopía. La semana pasada, un día se tuvimos un parancia que hagan el área de trabajo y tuvimos que cambiar la parte de no se no hace falta un poste. Me diste muy un poste con tres gravas. Un poste. Un poste, sí, un poste de la cerca. Ok, va a que perfil va a ese. ¿Vas a eternismo perfil? Sí, corre, estudimos perfil. Y la condición va a nombre de Ocic Concert, que no lo vi. ¿Ocic? Es, Office Concert, que no lo vi. Y ese tiene la afartura y que lo pagaron para no mangar y lo requercan. Aca en un daño. Yo lo buco y apenas en cuanto al perfil, entonces le hago llegar la cosa. Sí, para que yo... Un poste y tres clip. Sí, corre esto. Tres clip, no, son los tres clip de postes. Y tres más. Ok, sería un 6. Son 6, soy correcto. Ya ahorita unos minutos, yo le busco la perfil anterior y le envío la cotización. ¿Cómo se hagas ya? Gracias, Honte.",18.262896060943604
audio_cpbx06.vozelia.com.pa-1748869967.19947341,base," ¿Qué es? Hola, hoy día, hablamos de empezar a torro a rap, la blalla y ven con el enganjuan. ¿Y en la blalla? Le están llamando por confirmar si le habían elevado la información sobre el cortador de Ceste. Sí, perfecto. Y me lo he hecho. ¿Y por el momento de volver a ser? ¿Qué he interesado si estaba con disminuado? ¿Qué es? ¿Cuánto es que era? Pero sí, eso comprarlo pero en la pincena que viene. ¿Qué? ¿Sería mitad de mes? Pero yo no estaría acercando ya. ¿Qué? Me dijo que era en el enganjian. ¿Aquí por Villalucrela de Panamá? Ah, Villalucrecia, son correctos. ¿Y por qué? En la orden de la enganjian. Sí, pero... ¡Chao!",16.17038345336914
audio_cpbx06.vozelia.com.pa-1748869173.19935707,small," Hola, buenos días. Sí, buenos días. Tengo el gusto con el señor Raúl. Sí, con mi amigo. Señor Raúl, la comoriana Carrón, el otro día estaba mirando por acá que usted me puso buenos días, venden. Ah, correcto, sí, y leí que la pregunta es que la embajada me parece que sí, que sí, que sí. Que si vendemos tancas de tíapia. Sí, alivines, alivines. Alivines, bueno, es que esa parte las conozco. Ajá. De igual manera, ¿voy a... Sí, pues el pescadito pequeño. Ok, voy a asignar lo que es una oportunidad para una compañera que ve, que ve ese tipo de tanques de tíapia y todo lo que sea de tíapia, entonces ella va a estar comunicándose con usted. Ah, bueno, sí, lo que quería decir es que no sé dónde conseguir la tíapia, porque es pequeñita. Ajá, compré. Bueno, déjenme consultar por acá. Y yo les voy a decir. Ah, bien, bien, se dan. Buen día.",28.160333156585693
audio_cpbx06.vozelia.com.pa-1748869815.19945115,small," ¿Qué? ¿Qué? ¿Qué? ¿Qué? ¿Qué? ¿Qué? ¿Qué? ¿Qué? ¿Qué? ¿Qué? ¿Qué? ¿Qué? ¿Qué? ¿Qué? ¿Qué? ¿Qué? ¿Qué? ¿Qué? ¿Qué? ¿Qué? ¿Qué? ¿Qué? ¿Qué? ¿Qué? ¿Qué? ¿Qué? ¿Qué? ¿Qué? Lo hicimos y nos retiró todos los días. La semana pasada. Entonces, tuvimos un pecado acá en el área de trabajo y tuvimos que cambiar la parte que nos hace. Falta un poste. Necesitamos un poste con tres grapas. Un poste. Un poste con el poste si, el poste de la cerca. ¿Ok? ¿Va a qué perfil va ese? ¿Va a este mismo perfil? Si, correcto. El mismo perfil, y la conversación va a nombre de Office Concert. No lo vi. Office? Es Office Concept, que no lo vi. Y, esa tiene las faturas y que lo pagarán en Panamá y lo requiere acá en Gallip. Ah, acá en Gallip. Yo lo busco y... y apenas encuentro el Barcelona, entonces le hago llegar la cosita. Sí, para que... ¿Un botón y tres clips? Sí, correcto. ¿Tres clips? No, son... Los tres clips de botones y tres más. Ok, sería un seis. Son seis, son correctos. Vale, ya ahorita tengo unos minutitos que vos les busco el perfil anterior y le envío la cotización. Muchas gracias. Gracias, Octen.",77.18850541114807
audio_cpbx06.vozelia.com.pa-1748869967.19947341,small," ¿Qué tal? Hola, bien día. Le hablamos de empresa Toro Rapp, la habla ahí de Alibens con el señor Juan. Sí, ¿qué hablás? Le estaba llamando para confirmar si el día viernes le brindaron la información sobre el cortador de este. Sí, perfecto. Me ayudó. Ok, por el momento no me parece... ¿Qué interesado? Qué interesado, sí, estaba cotizando. Quería saber cuántos que eran, pero sí, quiso comprarlo en la pincena que viene. Ok, ok. Sería a mitad de mes. Sí, pero yo no estaría acercando allá. Ok. Me dijo que eran Juan Díaz, ¿no? Aquí por Villalu, creé la de Panamá. Ah, Villalu creé, sí, a la pincel. Correcto. A la orden de hoy en día. Bueno, pero... Chao.",24.233368396759033
audio_cpbx06.vozelia.com.pa-1748869173.19935707,medium," Hola, buenos días. Sí, buenos días. Tengo el gusto con el señor Raúl. Sí, ¿con quién hablo? El señor Raúl habla con Oriana Cerroná de Trotrag. Estaba mirando por acá que usted me puso buenos días vende... Ah, correcto. Sí, sí, le hice la pregunta que la he pasado, me parece que sí, que vive eso. ¿Que si vendemos tanques de tilapia? Sí, alvines, alvines. Alvines, bueno, esa parte la conozco. Ajá. De igual manera... Pues, pescaditos pequeños. Ok, voy a asignar lo que es una oportunidad para una compañera que ve todo ese tipo de tanques de tilapia y todo lo que sea de tilapia. Entonces ella va a estar comunicándose con usted. Ah, bueno, sí, lo que quería decir es que no sé dónde construir... Quería decir, pequeñita. Ajá, comprendo. Bueno, déjenme consultar por acá y yo la seguiré. Ah, sí. Gracias. Tenga buen día.",75.13145661354065
audio_cpbx06.vozelia.com.pa-1748869815.19945115,medium," Aló. Hola, mi nombre es María Luz de Valdejar Juan. Sí, buena día. A señor Juan le hablamos de parte de todo, trae. Correcto, dígame. Me indica mi compañero que interesaba una nueva cotización. Sí, en un poste. La Oficon se compró una... Fue en 3 de mayo, de 2x2, y una puerta con los respectivos postes, pero... ¿De dos? Sí, correcto, pero nosotros... Eso lo retiré en estos días, la semana pasada. Entonces tuvimos un plan sacado en el área de trabajo y tuvimos que cambiar la parte, entonces nos hace falta un poste. Necesitamos un poste con tres grapas. ¿Un poste? Tres grapas, con el poste... sí, el poste de la cerca, pues. Ok. ¿Vas que perfil va ese? ¿Vas este mismo perfil? Sí, correcto, el mismo perfil. Y la cotización va a nombre de Office Concepts. Tengo 10. ¿Office? Office Concepts Technology. Y... Eso tiene la factura ahí que lo pagaron en Panamá y lo retiré acá en... acá en... Yo lo busco y... y apenas encuentra el perfil, entonces le hago llegar la cotización. Sí, para que... ¿Es un poste y tres clips? Sí, correcto. ¿Tres clips? No, son... Los tres clips de postes y tres más. Ok, ¿serían seis? Sí, son seis, seis, correcto. Vale. Ya ahorita en unos minutitos yo le busco el perfil anterior y le envío la cotización. Muchas gracias. Gracias a usted.",110.68014788627625
audio_cpbx06.vozelia.com.pa-1748869967.19947341,medium," Hola, bien. Hola, hoy en día le hablamos de empresa Toro Trap. Le hablé a Yari Benz con Daniel Juan. Sí, él me habló. Le estaba llamando para confirmar. Sí, el día viernes le brindaron la información sobre el portador de cestos. Sí, perfecto. Me llegó. Ok, por el momento no está en el texto. Y estoy interesado. Estoy interesado si estaba cotizando. Yo quería saber cuántos eran, pero sí pienso comprarlo en la pincera que viene. Ok, ok. Sería a mitad de mes. Sí, pero yo no estaría acercando allá. Ok. Me dijo que era en Juan Díaz, ¿no? Aquí por Villa Lucre, la de Panamá. Ah, Villa Lucre, sí. Sí, correcto. Listo. A la orden de Juan Díaz. Ok, adiós. Adiós.",68.03110766410828
audio_cpbx06.vozelia.com.pa-1748869173.19935707,large," Hola, buenos días. Sí, buenos días. Tengo el gusto con el señor Raúl. Sí, ¿con quién hablo? Señor Raúl, habla con Oriana Serrano de Trotrae. Estaba mirando por acá que usted me puso buenos días, venden a... Sí, leí la pregunta que me ha pasado me parece que sí, que sí, que sí. Que si vendemos tanques de tilapia. Sí, este, a Levine, a Levine. A Levine, bueno, esa parte la conozco. Ajá. De igual manera voy a... El pescadito pequeño. Ok, voy a asignar lo que es una oportunidad para una compañera que es la que ve ese tipo de tanques de tilapia y todo lo que sea de tilapia. Entonces ella va a estar comunicándose con usted. Ah, bueno, sí, lo que quería decir es que no sé dónde conseguí la cría pequeñita. Ajá. Ah, compré. Bueno, déjeme consultar por acá y yo la estoy haciendo. Ah, sí, gracias. Muchas gracias. Tenga buen día.",162.33730673789978
audio_cpbx06.vozelia.com.pa-1748869815.19945115,large," aló señor juan si, buenos días señor juan le hablamos de partes de perotrae correcto, dígame me indica mi compañero que está interesado en una nueva cotización si, en un poste la oficina se compró una, una, se compró en 3 mayo de 2x2 y una puerta con los respectivos postes pero, como hicimos un cambio si, correcto, pero nosotros eso yo lo recibí en estos días, la semana pasada entonces tuvimos un plan sacado en el área de trabajo y tuvimos que cambiar la puerta, entonces nos hace falta un poste necesitamos un poste con 3 grapas un poste 3 grapas con el poste de la cerca ok, va que perfil va ese va este mismo perfil si, correcto, el mismo perfil y la cotización va a nombre de office concept technology office office concept technology eso tiene la factura que lo pagaron en panamá y lo retiraron acá en yo lo busco y apenas encuentro el perfil entonces le hago llegar la cotización es un poste y 3 clips si, correcto 3 clips, no son los 3 clips de postes y 3 más ok, serían 6, son 6, correcto vale ya ahorita en unos minutitos yo le busco el perfil anterior y le envío la cotización muchas gracias gracias a usted",186.16456770896912
audio_cpbx06.vozelia.com.pa-1748869967.19947341,large, hola hola hoy en día le hablamos de empresa ToroTrap le hablé a Iber con el señor Juan si me habla le estaba llamando para confirmar si el día viernes le brindaron la la información sobre el portador de cestas si perfecto me llegó ok por el momento estoy interesado estoy interesado si estaba cotizando pero si intento comprarlo pero en la quincena que viene ok ok sería a mitad de mes si pero yo me estaría acercando allá ok me dijo que era en Juan Díaz aquí por Villa Lucre la de Panamá ah Villa Lucre correcto a la orden que tenga buen día pero no,110.85599184036255
